{
  "$schema": "./scope-map.schema.json",
  "service": "x64dbg",
  "mcpProtocolVersion": "2024-11-05",
  "description": "Delegated-scope map for duty1g/x64dbg-mcp-server (71 tools). Every tool is placed. Unmapped tool names are denied (unmappedPolicy=deny). This file is the reviewable authorization artifact; the proxy loads it, it is not hardcoded.",
  "unmappedPolicy": "deny",
  "classificationPrinciples": [
    "read is strictly non-mutating: it observes process/debugger state and returns data. Nothing that changes state (including analysis-DB annotations or clearing logs) is read.",
    "control changes execution flow and breakpoint state but does not write process memory/registers or move bytes to disk.",
    "write mutates process memory, registers, thread run-state, patches, or the debugger's persistent analysis database (comments, labels, bookmarks, event log).",
    "session controls the debug target's lifecycle (load/attach/stop/restart). These create or destroy the thing every other scope operates on.",
    "exfil moves process memory to disk. It is separated from read because a read scope must not authorize bulk extraction to the filesystem.",
    "A tool whose capability cannot be bounded from outside the process (arbitrary command or expression surface) is denied or flagged, never silently mapped to a scope."
  ],
  "scopes": {
    "x64dbg:read": "Observe process and debugger state. Non-mutating.",
    "x64dbg:control": "Drive execution and breakpoints (run, step, pause, breakpoints, thread switch).",
    "x64dbg:write": "Mutate process memory, registers, thread run-state, patches, or the debugger analysis database.",
    "x64dbg:session": "Create or destroy the debug target (load, attach, stop, restart).",
    "x64dbg:exfil": "Write process memory to disk (memory/module dumps)."
  },
  "specialDispositions": {
    "ExecuteDebuggerCommand": {
      "deny": true,
      "reason": "Arbitrary x64dbg command string. Reaches the capability of most of the other 70 tools, so any scope mapping would be a bypass. Denied outright. See ADR-0001.",
      "catchAll": true
    },
    "EvalExpression": {
      "scope": "x64dbg:read",
      "caveat": "SECONDARY CATCH-ALL RISK. x64dbg's expression engine is broader than a pure reader: depending on build it can dereference and, in some contexts, assign. It is mapped to read for analyst usefulness but is a documented residual. Operators wanting a hard boundary should move it to deny here (it is config, not code). See ADR-0001 and README threat model.",
      "catchAll": true
    }
  },
  "tools": {
    "GetDebugState": "x64dbg:read",
    "GetEventLog": "x64dbg:read",
    "ListCommandsByCategory": "x64dbg:read",
    "SearchForStrings": "x64dbg:read",
    "Echo": "x64dbg:read",
    "GetCurrentAddress": "x64dbg:read",
    "Disassemble": "x64dbg:read",
    "DisassembleFunction": "x64dbg:read",
    "ReadMemory": "x64dbg:read",
    "WaitForPause": "x64dbg:read",
    "ListBreakpoints": "x64dbg:read",
    "GetAllRegisters": "x64dbg:read",
    "GetCallStack": "x64dbg:read",
    "GetThreads": "x64dbg:read",
    "ListModules": "x64dbg:read",
    "GetMemoryMap": "x64dbg:read",
    "GetDumpableRegions": "x64dbg:read",
    "ListBookmarks": "x64dbg:read",
    "GetImports": "x64dbg:read",
    "GetExports": "x64dbg:read",
    "SearchSymbols": "x64dbg:read",
    "ListSymbols": "x64dbg:read",
    "GetPatches": "x64dbg:read",
    "FindPattern": "x64dbg:read",
    "GetStrings": "x64dbg:read",
    "GetReferences": "x64dbg:read",
    "GetFunctions": "x64dbg:read",
    "AnalyzeModule": "x64dbg:read",
    "DetectOEP": "x64dbg:read",
    "FollowPointer": "x64dbg:read",
    "WatchExpressions": "x64dbg:read",
    "GetSEHChain": "x64dbg:read",
    "GetPEB": "x64dbg:read",
    "GetArguments": "x64dbg:read",
    "EvalExpression": "x64dbg:read",

    "run": "x64dbg:control",
    "StepInto": "x64dbg:control",
    "StepOver": "x64dbg:control",
    "StepOut": "x64dbg:control",
    "PauseDebug": "x64dbg:control",
    "RunToAddress": "x64dbg:control",
    "TraceInto": "x64dbg:control",
    "SwitchThread": "x64dbg:control",
    "SetBreakpoint": "x64dbg:control",
    "SetHardwareBreakpoint": "x64dbg:control",
    "SetConditionalBreakpoint": "x64dbg:control",
    "EnableBreakpoint": "x64dbg:control",
    "DisableBreakpoint": "x64dbg:control",
    "ToggleBreakpoint": "x64dbg:control",
    "DeleteBreakpoint": "x64dbg:control",
    "DeleteAllBreakpoints": "x64dbg:control",
    "ResetHitCount": "x64dbg:control",

    "WriteMemToAddress": "x64dbg:write",
    "Assemble": "x64dbg:write",
    "SetRegister": "x64dbg:write",
    "AllocateMemory": "x64dbg:write",
    "FreeMemory": "x64dbg:write",
    "RestorePatches": "x64dbg:write",
    "SuspendThread": "x64dbg:write",
    "ResumeThread": "x64dbg:write",
    "CommentOrLabelAtAddress": "x64dbg:write",
    "SetBookmark": "x64dbg:write",
    "DeleteBookmark": "x64dbg:write",
    "ClearEventLog": "x64dbg:write",

    "LoadBinary": "x64dbg:session",
    "AttachProcess": "x64dbg:session",
    "StopDebug": "x64dbg:session",
    "RestartDebug": "x64dbg:session",

    "DumpMemory": "x64dbg:exfil",
    "DumpModule": "x64dbg:exfil",

    "ExecuteDebuggerCommand": { "deny": true, "reason": "arbitrary-command catch-all; denied outright (see ADR-0001)" }
  }
}
